{
  "schema": "otsec.asset/0.1",
  "asset_id": "2b7d4e10-8c3f-4a5b-9e21-7c4f0d6a8b13",
  "node_id": "site-a-node1",
  "attributes": [
    {
      "name": "device_class",
      "value": "protective-relay",
      "confidence": "single-source",
      "observations": [
        {
          "value": "protective-relay",
          "evidence_class": "operator-declared",
          "source": {
            "method": "operator-entry",
            "ref": "operator:commissioning-sheet-07",
            "observed_at": "2026-10-24T09:00:00Z"
          }
        }
      ]
    },
    {
      "name": "vendor",
      "value": "sel",
      "confidence": "single-source",
      "observations": [
        {
          "value": "sel",
          "evidence_class": "operator-declared",
          "source": {
            "method": "operator-entry",
            "ref": "operator:commissioning-sheet-07",
            "observed_at": "2026-10-24T09:00:00Z"
          }
        }
      ]
    },
    {
      "name": "product_family",
      "value": "sel-751",
      "confidence": "single-source",
      "observations": [
        {
          "value": "sel-751",
          "evidence_class": "operator-declared",
          "source": {
            "method": "operator-entry",
            "ref": "operator:commissioning-sheet-07",
            "observed_at": "2026-10-24T09:00:00Z"
          }
        }
      ]
    },
    {
      "name": "firmware_id",
      "value": "SEL-751-R501-V0-Z104101-D20260910",
      "confidence": "corroborated",
      "observations": [
        {
          "value": "SEL-751-R501-V0-Z104101-D20260910",
          "evidence_class": "operator-declared",
          "source": {
            "method": "operator-entry",
            "ref": "operator:commissioning-sheet-07",
            "observed_at": "2026-10-24T09:00:00Z"
          }
        },
        {
          "value": "SEL-751-R501-V0-Z104101-D20260910",
          "evidence_class": "simulated",
          "source": {
            "method": "simulator-session",
            "ref": "6f1c2b9e-3d4a-4c1e-9b7a-2f0e8d5c1a30",
            "observed_at": "2026-10-24T09:15:02.481Z",
            "span": {
              "offset": 42,
              "length": 33
            }
          }
        }
      ]
    },
    {
      "name": "serial_number",
      "value": "SIM0000000000001",
      "confidence": "single-source",
      "observations": [
        {
          "value": "SIM0000000000001",
          "evidence_class": "operator-declared",
          "source": {
            "method": "operator-entry",
            "ref": "operator:commissioning-sheet-07",
            "observed_at": "2026-10-24T09:00:00Z"
          }
        }
      ]
    },
    {
      "name": "sel.cid",
      "value": "E754",
      "confidence": "single-source",
      "observations": [
        {
          "value": "E754",
          "evidence_class": "simulated",
          "source": {
            "method": "simulator-session",
            "ref": "6f1c2b9e-3d4a-4c1e-9b7a-2f0e8d5c1a30",
            "observed_at": "2026-10-24T09:15:02.481Z",
            "span": {
              "offset": 98,
              "length": 4
            }
          }
        }
      ]
    },
    {
      "name": "ip_address",
      "value": "192.0.2.21",
      "confidence": "single-source",
      "observations": [
        {
          "value": "192.0.2.21",
          "evidence_class": "operator-declared",
          "source": {
            "method": "operator-entry",
            "ref": "operator:commissioning-sheet-07",
            "observed_at": "2026-10-24T09:00:00Z"
          }
        }
      ]
    }
  ],
  "endpoints": [
    {
      "id": "port1-telnet",
      "transport": "telnet",
      "host": "192.0.2.21",
      "port": 23,
      "downstream_security": {
        "level": "plaintext-unauthenticated",
        "acknowledgement": {
          "by": "admin:lab-admin",
          "at": "2026-10-24T09:00:00Z",
          "reason": "Simulated slice only, lab-only credentials (ADR-0005)",
          "scope": "lab-only"
        }
      }
    }
  ],
  "identity_binding": {
    "method": "device-reported",
    "strength": "spoofable",
    "attributes": [
      "firmware_id",
      "serial_number"
    ]
  },
  "profile": {
    "id": "sel-751-ascii",
    "version": "0.1"
  }
}
