{
  "schema": "otsec.asset/0.1",
  "asset_id": "c41f8a2d-6b0e-4e97-8d13-5a2c9f7b0e64",
  "node_id": "site-a-node1",
  "attributes": [
    {
      "name": "device_class",
      "value": "automation-controller",
      "confidence": "single-source",
      "observations": [
        {
          "value": "automation-controller",
          "evidence_class": "operator-declared",
          "source": {
            "method": "operator-entry",
            "ref": "operator:commissioning-sheet-07",
            "observed_at": "2026-10-24T09:00:00Z"
          }
        }
      ]
    },
    {
      "name": "vendor",
      "value": "sel",
      "confidence": "single-source",
      "observations": [
        {
          "value": "sel",
          "evidence_class": "operator-declared",
          "source": {
            "method": "operator-entry",
            "ref": "operator:commissioning-sheet-07",
            "observed_at": "2026-10-24T09:00:00Z"
          }
        }
      ]
    },
    {
      "name": "product_family",
      "value": "sel-rtac",
      "confidence": "single-source",
      "observations": [
        {
          "value": "sel-rtac",
          "evidence_class": "operator-declared",
          "source": {
            "method": "operator-entry",
            "ref": "operator:commissioning-sheet-07",
            "observed_at": "2026-10-24T09:00:00Z"
          }
        }
      ]
    },
    {
      "name": "ip_address",
      "value": "192.0.2.40",
      "confidence": "single-source",
      "observations": [
        {
          "value": "192.0.2.40",
          "evidence_class": "operator-declared",
          "source": {
            "method": "operator-entry",
            "ref": "operator:commissioning-sheet-07",
            "observed_at": "2026-10-24T09:00:00Z"
          }
        }
      ]
    }
  ],
  "endpoints": [
    {
      "id": "syslog-in",
      "transport": "syslog-udp",
      "host": "192.0.2.40",
      "port": 514,
      "target": "simulated",
      "downstream_security": {
        "level": "plaintext-unauthenticated",
        "acknowledgement": {
          "by": "admin:lab-admin",
          "at": "2026-10-24T09:00:00Z",
          "reason": "RTAC Syslog is RFC 3164 over UDP only (A2 portfolio section 3)",
          "scope": "lab-only"
        }
      }
    }
  ],
  "identity_binding": {
    "method": "address-only",
    "strength": "spoofable",
    "attributes": []
  },
  "profile": {
    "id": "sel-rtac-syslog",
    "version": "0.1"
  }
}
